<?xml version="1.0" encoding="utf-8"?>
<!DOCTYPE expression SYSTEM "./dtd/expression.dtd">

<expression name="very_high_tensed">
	<char>
		<emotion name="tensed"/>
		<profile name="tensed"/>
		<time min="0.5" max="4"/>
		<intensity min="0.75" max="1"/>
		<desciption comment="" author=""/>
	</char>
	<face>
<fap num="3" value="-99"/>
<fap num="6" value="16"/>
<fap num="7" value="16"/>
<fap num="10" value="56"/>
<fap num="11" value="56"/>
<fap num="39" value="-160"/>
<fap num="40" value="-160"/>
<fap num="41" value="120"/>
<fap num="42" value="120"/>
<fap num="51" value="165"/>
<fap num="52" value="198"/>
<fap num="53" value="11"/>
<fap num="54" value="11"/>
<fap num="55" value="99"/>
<fap num="56" value="99"/>
<fap num="57" value="17"/>
<fap num="58" value="17"/>
<fap num="59" value="-50"/>
<fap num="60" value="-50"/>
<fap num="19" value="200"/>
<fap num="20" value="200"/>
<fap num="21" value="100"/>
<fap num="22" value="100"/>
<fap num="31" value="60"/>
<fap num="32" value="60"/>
	</face>
	<cons>
	</cons>
</expression>

