<?xml version="1.0" encoding="utf-8"?>
<!DOCTYPE expression SYSTEM "./dtd/expression.dtd">

<expression name="high_fear">
	<char>
		<emotion name="fear"/>
		<profile name="fear"/>
		<time min="0.5" max="4"/>
		<intensity min="0.5" max="0.75"/>
		<desciption comment="" author="radek"/>
	</char>
	<face>
<fap num="3" value="105"/>
<fap num="5" value="-189"/>
<fap num="10" value="-336"/>
<fap num="11" value="-336"/>
<fap num="12" value="-105"/>
<fap num="13" value="-105"/>
<fap num="51" value="73"/>
<fap num="52" value="-14"/>
<fap num="55" value="63"/>
<fap num="56" value="63"/>
<fap num="57" value="357"/>
<fap num="58" value="518"/>
<fap num="59" value="-105"/>
<fap num="60" value="-105"/>
<fap num="19" value="-200"/>
<fap num="20" value="-200"/>
<fap num="21" value="-100"/>
<fap num="22" value="-100"/>
<fap num="31" value="45"/>
<fap num="32" value="45"/>
<fap num="33" value="90"/>
<fap num="34" value="90"/>
<fap num="35" value="45"/>
<fap num="36" value="45"/>
<fap num="37" value="67"/>
<fap num="38" value="67"/>
	</face>
	<cons>
	</cons>
</expression>


