<?xml version="1.0" encoding="utf-8"?>
<!DOCTYPE expression SYSTEM "./dtd/expression.dtd">

<expression name="low_anger">
	<char>
		<emotion name="anger"/>
		<profile name="anger"/>
		<time min="0.5" max="4"/>
		<intensity min="0.25" max="0.5"/>
		<desciption comment="" author=""/>
	</char>
	<face>
<fap num="31" value="-122"/>
<fap num="32" value="-122"/>
<fap num="33" value="-140"/>
<fap num="34" value="-140"/>
<fap num="35" value="-14"/>
<fap num="36" value="-14"/>
<fap num="37" value="84"/>
<fap num="38" value="84"/>
	</face>
	<cons>
	</cons>
</expression>





