<?xml version="1.0" encoding="utf-8"?>
<!DOCTYPE expression SYSTEM "./dtd/expression.dtd">

<expression name="very_low_joy">
	<char>
		<emotion name="joy"/>
		<profile name="joy"/>
		<time min="0.5" max="4"/>
		<intensity min="0" max="0.25"/>
		<desciption comment="" author="radek"/>
	</char>
	<face>
<fap num="4" value="-45"/>
<fap num="5" value="105"/>
<fap num="18" value="30"/>
<fap num="41" value="95"/>
<fap num="42" value="95"/>
<fap num="51" value="-5"/>
<fap num="52" value="85"/>
<fap num="53" value="35"/>
<fap num="54" value="35"/>
<fap num="55" value="-5"/>
<fap num="56" value="-5"/>
<fap num="59" value="105"/>
<fap num="60" value="105"/>
	</face>
	<cons>
	</cons>
</expression>

