<?xml version="1.0" encoding="utf-8"?>
<!DOCTYPE expression SYSTEM "./dtd/expression.dtd">

<expression name="low_tensed">
	<char>
		<emotion name="tensed"/>
		<profile name="tensed"/>
		<time min="0.5" max="4"/>
		<intensity min="0.25" max="0.5"/>
		<desciption comment="" author="radek"/>
	</char>
	<face>
<fap num="3" value="-89"/>
<fap num="6" value="14"/>
<fap num="7" value="14"/>
<fap num="10" value="50"/>
<fap num="11" value="50"/>
<fap num="39" value="-126"/>
<fap num="40" value="-126"/>
<fap num="51" value="148"/>
<fap num="52" value="178"/>
<fap num="53" value="9"/>
<fap num="54" value="9"/>
<fap num="55" value="89"/>
<fap num="56" value="89"/>
<fap num="57" value="15"/>
<fap num="58" value="15"/>
<fap num="59" value="-45"/>
<fap num="60" value="-45"/>
	</face>
	<cons>
	</cons>
</expression>




